10:02:45.755831 IP a01c5d46d4f6.54594 > 172.17.0.2.5000: Flags [S], seq 884147817, win 64240, options [mss 1460,sackOK,TS val 3824092673 ecr 0,nop,wscale 7], length 0
10:02:45.755976 IP 172.17.0.2.5000 > a01c5d46d4f6.54594: Flags [S.], seq 2217901829, ack 884147818, win 65160, options [mss 1460,sackOK,TS val 2869521796 ecr 3824092673,nop,wscale 7], length 0
10:02:45.755989 IP a01c5d46d4f6.54594 > 172.17.0.2.5000: Flags [.], ack 1, win 502, options [nop,nop,TS val 3824092673 ecr 2869521796], length 0
10:02:45.756040 IP a01c5d46d4f6.54594 > 172.17.0.2.5000: Flags [P.], seq 1:81, ack 1, win 502, options [nop,nop,TS val 3824092673 ecr 2869521796], length 80
10:02:45.756052 IP 172.17.0.2.5000 > a01c5d46d4f6.54594: Flags [.], ack 81, win 509, options [nop,nop,TS val 2869521796 ecr 3824092673], length 0
10:02:45.765596 IP a01c5d46d4f6.58624 > metadata.google.internal.53: 13958+ PTR? 2.0.17.172.in-addr.arpa. (41)
10:02:45.772129 IP metadata.google.internal.53 > a01c5d46d4f6.58624: 13958 NXDomain 0/1/0 (138)
10:02:46.789330 IP a01c5d46d4f6.44358 > metadata.google.internal.53: 59390+ PTR? 254.169.254.169.in-addr.arpa. (46)
10:02:46.790822 IP metadata.google.internal.53 > a01c5d46d4f6.44358: 59390 1/0/0 PTR metadata.google.internal. (84)
10:02:50.917136 ARP, Request who-has 172.17.0.1 tell a01c5d46d4f6, length 28
10:02:50.917126 ARP, Request who-has a01c5d46d4f6 tell 172.17.0.1, length 28
10:02:50.917152 ARP, Request who-has 172.17.0.2 tell a01c5d46d4f6, length 28
10:02:50.917159 ARP, Reply a01c5d46d4f6 is-at 02:42:ac:11:00:03 (oui Unknown), length 28
10:02:50.917168 ARP, Reply 172.17.0.1 is-at 02:42:e6:89:44:7f (oui Unknown), length 28
10:02:50.917195 ARP, Request who-has a01c5d46d4f6 tell 172.17.0.2, length 28
10:02:50.917200 ARP, Reply a01c5d46d4f6 is-at 02:42:ac:11:00:03 (oui Unknown), length 28
10:02:50.917207 ARP, Reply 172.17.0.2 is-at 02:42:ac:11:00:02 (oui Unknown), length 28
10:02:51.909314 IP a01c5d46d4f6.60113 > metadata.google.internal.53: 27859+ PTR? 1.0.17.172.in-addr.arpa. (41)
10:02:51.915439 IP metadata.google.internal.53 > a01c5d46d4f6.60113: 27859 NXDomain 0/1/0 (138)
10:03:24.096606 IP 172.17.0.2.5000 > a01c5d46d4f6.54594: Flags [P.], seq 1:81, ack 81, win 509, options [nop,nop,TS val 2869560137 ecr 3824092673], length 80
10:03:24.096629 IP a01c5d46d4f6.54594 > 172.17.0.2.5000: Flags [.], ack 81, win 502, options [nop,nop,TS val 3824131014 ecr 2869560137], length 0
10:03:30.249490 IP a01c5d46d4f6.54594 > 172.17.0.2.5000: Flags [P.], seq 81:161, ack 81, win 502, options [nop,nop,TS val 3824137167 ecr 2869560137], length 80
10:03:30.249559 IP 172.17.0.2.5000 > a01c5d46d4f6.54594: Flags [.], ack 161, win 509, options [nop,nop,TS val 2869566290 ecr 3824137167], length 0
10:03:33.565451 IP 172.17.0.2.5000 > a01c5d46d4f6.54594: Flags [P.], seq 81:161, ack 161, win 509, options [nop,nop,TS val 2869569606 ecr 3824137167], length 80
10:03:33.565482 IP a01c5d46d4f6.54594 > 172.17.0.2.5000: Flags [.], ack 161, win 502, options [nop,nop,TS val 3824140483 ecr 2869569606], length 0
10:03:35.461156 ARP, Request who-has a01c5d46d4f6 tell 172.17.0.2, length 28
10:03:35.461167 ARP, Reply a01c5d46d4f6 is-at 02:42:ac:11:00:03 (oui Unknown), length 28
10:03:37.146770 IP a01c5d46d4f6.54594 > 172.17.0.2.5000: Flags [P.], seq 161:241, ack 161, win 502, options [nop,nop,TS val 3824144064 ecr 2869569606], length 80
10:03:37.146829 IP 172.17.0.2.5000 > a01c5d46d4f6.54594: Flags [.], ack 241, win 509, options [nop,nop,TS val 2869573187 ecr 3824144064], length 0
10:03:39.068813 IP a01c5d46d4f6.54594 > 172.17.0.2.5000: Flags [F.], seq 241, ack 161, win 502, options [nop,nop,TS val 3824145986 ecr 2869573187], length 0
10:03:39.109351 IP 172.17.0.2.5000 > a01c5d46d4f6.54594: Flags [.], ack 242, win 509, options [nop,nop,TS val 2869575150 ecr 3824145986], length 0
10:03:40.043661 IP 172.17.0.2.5000 > a01c5d46d4f6.54594: Flags [F.], seq 161, ack 242, win 509, options [nop,nop,TS val 2869576084 ecr 3824145986], length 0
10:03:40.043678 IP a01c5d46d4f6.54594 > 172.17.0.2.5000: Flags [.], ack 162, win 502, options [nop,nop,TS val 3824146961 ecr 2869576084], length 0

